{
  "$schema": "https://json-schema.org/draft/2020-12/schema",
  "$id": "https://hees.ai/contracts/console/scenario_0_1.schema.json",
  "title": "hees.ai console Build Week initial-profile deterministic scenario",
  "type": "object",
  "additionalProperties": false,
  "required": ["scenario_contract", "profile_id", "scenario_id", "title", "package_id", "domain_id", "package_revision", "artifact_digest", "request_path", "proposal_path", "manifest_target_paths", "observation_paths", "expected_result"],
  "properties": {
    "scenario_contract": {"const": "console_scenario_0_1"},
    "profile_id": {"const": "console_profile_0_1"},
    "scenario_id": {"type": "string", "pattern": "^[a-z0-9][a-z0-9_-]{0,127}$"},
    "title": {"type": "string", "minLength": 1, "maxLength": 128},
    "package_id": {"type": "string", "pattern": "^[a-z0-9][a-z0-9_-]{0,127}$"},
    "domain_id": {"type": "string", "pattern": "^[a-z0-9][a-z0-9_-]{0,127}$"},
    "package_revision": {"type": "string", "pattern": "^[0-9]+\\.[0-9]+\\.[0-9]+$", "maxLength": 32},
    "artifact_digest": {"type": "string", "pattern": "^sha256:[0-9a-f]{64}$"},
    "request_path": {"type": "string", "pattern": "^(?!/)(?!.*(?:^|/)\\.\\.(?:/|$))(?!.*\\\\)[a-z0-9_./-]+$"},
    "proposal_path": {"type": "string", "pattern": "^(?!/)(?!.*(?:^|/)\\.\\.(?:/|$))(?!.*\\\\)[a-z0-9_./-]+$"},
    "manifest_target_paths": {"type": "array", "minItems": 0, "maxItems": 16, "uniqueItems": true, "items": {"type": "string", "pattern": "^(?!/)(?!.*(?:^|/)\\.\\.(?:/|$))(?!.*\\\\)[a-z0-9_./-]+$"}},
    "observation_paths": {"type": "array", "minItems": 0, "maxItems": 8, "uniqueItems": true, "items": {"type": "string", "pattern": "^(?!/)(?!.*(?:^|/)\\.\\.(?:/|$))(?!.*\\\\)[a-z0-9_./-]+$"}},
    "expected_result": {
      "type": "object",
      "additionalProperties": false,
      "required": ["decision", "reason_namespace", "reason", "selected_memory_ids"],
      "properties": {
        "decision": {"enum": ["admit", "reject"]},
        "reason_namespace": {"const": "console_admission_0_1"},
        "reason": {
          "enum": [
            "request_too_large",
            "invalid_json",
            "unsupported_request_contract",
            "invalid_request_schema",
            "replay_integrity_mismatch",
            "package_unavailable",
            "invalid_package",
            "memory_context_invalid",
            "package_id_mismatch",
            "domain_id_mismatch",
            "package_revision_mismatch",
            "artifact_digest_mismatch",
            "request_id_invalid",
            "request_digest_mismatch",
            "proposal_provider_unavailable",
            "unsupported_proposal_contract",
            "invalid_proposal_schema",
            "proposal_too_large",
            "proposal_request_mismatch",
            "missing_visible_output",
            "invalid_visible_unit",
            "unknown_action",
            "duplicate_evidence_reference",
            "evidence_required",
            "unknown_evidence",
            "support_mapping_invalid",
            "duplicate_memory_reference",
            "unknown_memory",
            "memory_not_admitted",
            "manifest_construction_failed",
            "unsupported_observation_contract",
            "observation_identity_mismatch",
            "observation_coverage_invalid",
            "observation_malformed",
            "observation_unavailable",
            "support_not_established",
            "contradiction_detected",
            "synthesis_incomplete",
            "finding_uncertain",
            "structural_admission_rejected",
            "selected_memory_invalid",
            "content_dna_construction_failed",
            "receipt_projection_failed",
            "admitted"
          ]
        },
        "selected_memory_ids": {"type": "array", "minItems": 0, "maxItems": 8, "uniqueItems": true, "items": {"type": "string", "pattern": "^[a-z0-9][a-z0-9_-]{0,127}$"}},
        "content_dna_path": {"type": "string", "pattern": "^(?!/)(?!.*(?:^|/)\\.\\.(?:/|$))(?!.*\\\\)[a-z0-9_./-]+$"},
        "receipt_path": {"type": "string", "pattern": "^(?!/)(?!.*(?:^|/)\\.\\.(?:/|$))(?!.*\\\\)[a-z0-9_./-]+$"}
      }
    }
  }
}
