{
  "scenario_contract": "console_scenario_0_1",
  "profile_id": "console_profile_0_1",
  "scenario_id": "scenario_unknown_evidence",
  "title": "Reject an unknown evidence reference",
  "package_id": "lantern_labs",
  "domain_id": "fictional_lesson_support",
  "package_revision": "1.0.0",
  "artifact_digest": "sha256:e4fd8da08bf9635d4753d8d70be77caa4aae59e756f72d9a9b177bca4603b335",
  "request_path": "requests/unknown_evidence.json",
  "proposal_path": "proposals/unknown_evidence.json",
  "manifest_target_paths": [],
  "observation_paths": [],
  "expected_result": {
    "decision": "reject",
    "reason_namespace": "console_admission_0_1",
    "reason": "unknown_evidence",
    "selected_memory_ids": []
  }
}
